{
  "$schema": "../../schemas/integration-v1.json",
  "schema": "ipad-agent.integration/v1",
  "version": 1,
  "id": "maps",
  "name": "Maps",
  "kind": "core",
  "bundle_ids": [
    "com.apple.Maps"
  ],
  "aliases": [
    "maps",
    "apple maps"
  ],
  "capabilities": [
    "launch",
    "direct-search",
    "direct-destination",
    "direct-directions",
    "ui-search-fallback",
    "dismiss-ui-fallback"
  ],
  "selectors": {
    "search": {
      "using": "accessibility id",
      "value": "MapsSearchTextField",
      "cache": false
    },
    "dismiss": {
      "using": "-ios predicate string",
      "value": "label == 'Dismiss' AND visible == 1",
      "cache": false
    }
  },
  "actions": {
    "activate": {
      "description": "Bring Maps to the foreground without changing the current map.",
      "capability": "launch",
      "steps": [
        {
          "operation": "activate"
        }
      ],
      "safety": "navigate",
      "retry": "safe_repeat"
    },
    "open-search": {
      "description": "Open a caller-encoded Maps search URL for an explicit query.",
      "capability": "direct-search",
      "steps": [
        {
          "operation": "open-url",
          "value": "maps://?q={encoded_query}"
        }
      ],
      "safety": "transient",
      "retry": "inspect_then_decide"
    },
    "open-destination": {
      "description": "Open a caller-encoded destination in Maps without starting turn-by-turn navigation.",
      "capability": "direct-destination",
      "steps": [
        {
          "operation": "open-url",
          "value": "maps://?q={encoded_destination}"
        }
      ],
      "safety": "transient",
      "retry": "inspect_then_decide"
    },
    "open-directions": {
      "description": "Open a caller-encoded Maps directions request and stop at route preview.",
      "capability": "direct-directions",
      "steps": [
        {
          "operation": "open-url",
          "value": "maps://?daddr={encoded_destination}"
        }
      ],
      "safety": "transient",
      "retry": "inspect_then_decide"
    },
    "search-ui-fallback": {
      "description": "If direct URL delivery is unavailable, enter an explicit query in the visible Maps search field and stop at suggestions.",
      "capability": "ui-search-fallback",
      "steps": [
        {
          "operation": "clear-type",
          "selector": "search",
          "value": "{query}"
        }
      ],
      "safety": "transient",
      "retry": "inspect_then_decide"
    },
    "dismiss-ui-fallback": {
      "description": "Dismiss the visible fallback sheet when the English Dismiss control is present.",
      "capability": "dismiss-ui-fallback",
      "steps": [
        {
          "operation": "tap",
          "selector": "dismiss"
        }
      ],
      "safety": "transient",
      "retry": "inspect_then_decide"
    }
  },
  "scenarios": {
    "search-place-direct": {
      "description": "Open one explicit search through a Maps URL before considering UI automation.",
      "capabilities": [
        "launch",
        "direct-search"
      ],
      "actions": [
        "activate",
        "open-search"
      ],
      "safety": "transient",
      "retry": "inspect_then_decide"
    },
    "show-destination-direct": {
      "description": "Open one explicit destination through a Maps URL before considering UI automation.",
      "capabilities": [
        "launch",
        "direct-destination"
      ],
      "actions": [
        "activate",
        "open-destination"
      ],
      "safety": "transient",
      "retry": "inspect_then_decide"
    },
    "preview-directions-direct": {
      "description": "Open directions to an explicit destination and stop at route preview.",
      "capabilities": [
        "launch",
        "direct-directions"
      ],
      "actions": [
        "activate",
        "open-directions"
      ],
      "safety": "transient",
      "retry": "inspect_then_decide"
    },
    "find-place-ui-fallback": {
      "description": "Use one bounded search-field entry only after direct delivery is unavailable, observe suggestions, then dismiss the fallback sheet.",
      "capabilities": [
        "launch",
        "ui-search-fallback",
        "dismiss-ui-fallback"
      ],
      "actions": [
        "activate",
        "search-ui-fallback",
        "dismiss-ui-fallback"
      ],
      "safety": "transient",
      "retry": "inspect_then_decide"
    },
    "dismiss-fallback-sheet": {
      "description": "Dismiss one visible English Maps fallback sheet when the request no longer needs it.",
      "capabilities": [
        "launch",
        "dismiss-ui-fallback"
      ],
      "actions": [
        "activate",
        "dismiss-ui-fallback"
      ],
      "safety": "transient",
      "retry": "inspect_then_decide"
    }
  },
  "safety": {
    "classification": "navigate-and-transient-map-query",
    "mutates_user_data": true,
    "requires_confirmation": [],
    "prohibited": [
      "starting turn-by-turn navigation",
      "sharing a location or route",
      "changing location permissions",
      "editing guides, favorites, home, or work",
      "selecting an ambiguous UI search result",
      "payments or protected confirmations"
    ],
    "uncertain_outcome": "A dispatched URL or UI query may already be applied and recorded in Maps Recents. Inspect the visible map before any retry."
  },
  "retry": {
    "default": "inspect_then_decide",
    "max_attempts": 1,
    "idempotent_actions": [
      "activate"
    ]
  },
  "requirements": {
    "host": [
      "macOS with Xcode CoreDevice support",
      "Python 3.11 or newer",
      "Appium/XCUITest only for the UI fallback"
    ],
    "device": [
      "paired physical iPad",
      "unlocked iPad for UI fallback actions",
      "Developer Mode for UI fallback actions"
    ],
    "permissions": [
      "Trust This Computer",
      "locally signed WebDriverAgent only for UI fallback actions",
      "Maps location permission only when current-origin directions are requested"
    ]
  },
  "compatibility": {
    "platform": "iPadOS",
    "minimum_os": "17.0",
    "maximum_os": null,
    "locales": [
      "en"
    ],
    "verification": "unverified",
    "app_versions": []
  },
  "privacy": {
    "data_access": [
      "explicit place, destination, and origin supplied by the caller",
      "current location only when Maps already has permission and directions omit an origin",
      "visible Maps state during bounded fallback"
    ],
    "data_sent": [
      "place and route requests handled by Apple Maps"
    ],
    "retention": "The integration stores nothing. Maps may retain searches and destinations in Recents under the user's Maps settings.",
    "notes": "Encode every URL parameter before dispatch. The manifest stops at a place view, suggestions, or route preview and never starts guidance."
  }
}
