{
  "$schema": "../../schemas/integration-v1.json",
  "schema": "ipad-agent.integration/v1",
  "version": 1,
  "id": "safari",
  "name": "Safari",
  "kind": "core",
  "bundle_ids": [
    "com.apple.mobilesafari"
  ],
  "aliases": [
    "safari",
    "apple safari"
  ],
  "capabilities": [
    "launch",
    "open-url"
  ],
  "selectors": {},
  "actions": {
    "activate": {
      "description": "Bring built-in Safari to the foreground through CoreDevice without claiming a rendered page.",
      "capability": "launch",
      "steps": [
        {
          "operation": "activate"
        }
      ],
      "safety": "navigate",
      "retry": "safe_repeat"
    },
    "open-url": {
      "description": "Deliver one policy-validated HTTP or HTTPS URL directly through CoreDevice without a separate activation step.",
      "capability": "open-url",
      "steps": [
        {
          "operation": "open-url",
          "value": "{url}"
        }
      ],
      "safety": "transient",
      "retry": "inspect_then_decide"
    }
  },
  "scenarios": {
    "activate-direct": {
      "description": "Request one direct Safari activation.",
      "capabilities": [
        "launch"
      ],
      "actions": [
        "activate"
      ],
      "safety": "navigate",
      "retry": "safe_repeat"
    },
    "open-url-direct": {
      "description": "Deliver one caller-supplied HTTP or HTTPS URL directly, with no prelaunch ceremony.",
      "capabilities": [
        "open-url"
      ],
      "actions": [
        "open-url"
      ],
      "safety": "transient",
      "retry": "inspect_then_decide"
    }
  },
  "safety": {
    "classification": "optional-browser-navigation-with-persistent-tab-state",
    "mutates_user_data": true,
    "requires_confirmation": [],
    "prohibited": [
      "delivering any scheme other than HTTP or HTTPS, including x-web-search, x-safari-https, FTP, webclip, or guessed schemes",
      "opening or manipulating private browsing, extension routes, or browser settings",
      "closing, selecting, reordering, grouping, inventorying, or reading any tab outside the explicit request",
      "claiming tab ownership or automatic tab cleanup after URL delivery",
      "submitting forms, downloading files, changing accounts, making payments, performing destructive actions, or handling protected confirmations",
      "replaying URL delivery after dispatch begins or treating CoreDevice acceptance as rendering evidence"
    ],
    "uncertain_outcome": "Safari may have received the URL, changed history, reused a tab, or created a tab before a response was lost. Inspect with the user and never replay delivery automatically."
  },
  "retry": {
    "default": "inspect_then_decide",
    "max_attempts": 1,
    "idempotent_actions": [
      "activate"
    ]
  },
  "requirements": {
    "host": [
      "macOS with Xcode CoreDevice support",
      "Python 3.11 or newer"
    ],
    "device": [
      "paired physical iPad with built-in Safari",
      "unlocked iPad"
    ],
    "permissions": [
      "Trust This Computer"
    ]
  },
  "compatibility": {
    "platform": "iPadOS",
    "minimum_os": "26.6.1",
    "maximum_os": "26.6.1",
    "locales": [
      "not-applicable"
    ],
    "verification": "unverified",
    "app_versions": []
  },
  "privacy": {
    "data_access": [
      "one explicit HTTP or HTTPS URL supplied by the caller"
    ],
    "data_sent": [
      "the explicit URL to Safari and normal browser requests to its destination"
    ],
    "retention": "The integration stores no URL or tab inventory. Safari may retain history, website data, and tabs under the user's existing settings; automatic tab cleanup is unsupported.",
    "notes": "Production Safari is CoreDevice-only. Exact-profile route status is held separately in route-compatibility.json: website is proven, while the established YouTube convenience remains public as a candidate for backward compatibility."
  }
}
