{
  "$schema": "../../schemas/integration-v1.json",
  "schema": "ipad-agent.integration/v1",
  "version": 1,
  "id": "clock",
  "name": "Clock",
  "kind": "core",
  "bundle_ids": [
    "com.apple.mobiletimer"
  ],
  "aliases": [
    "clock",
    "apple clock"
  ],
  "capabilities": [
    "launch"
  ],
  "selectors": {},
  "actions": {
    "activate": {
      "description": "Bring Clock to the foreground through CoreDevice without changing clocks, alarms, stopwatch state, or timers.",
      "capability": "launch",
      "steps": [
        {
          "operation": "activate"
        }
      ],
      "safety": "navigate",
      "retry": "safe_repeat"
    }
  },
  "scenarios": {
    "activate-direct": {
      "description": "Request one direct Clock activation and stop without operating its contents.",
      "capabilities": [
        "launch"
      ],
      "actions": [
        "activate"
      ],
      "safety": "navigate",
      "retry": "safe_repeat"
    }
  },
  "safety": {
    "classification": "bounded-ui-navigation",
    "mutates_user_data": false,
    "requires_confirmation": [],
    "prohibited": [
      "adding, editing, deleting, enabling, disabling, starting, stopping, resetting, or otherwise operating clocks, alarms, stopwatches, or timers",
      "using undocumented Clock URL schemes, inferred App Intents, selectors, or coordinate automation",
      "protected confirmations"
    ],
    "uncertain_outcome": "Clock may already have foregrounded before a response was lost. Inspect once and do not replay the launch automatically."
  },
  "retry": {
    "default": "inspect_then_decide",
    "max_attempts": 1,
    "idempotent_actions": [
      "activate"
    ]
  },
  "requirements": {
    "host": [
      "macOS with Xcode CoreDevice support",
      "Python 3.11 or newer"
    ],
    "device": [
      "paired physical iPad with Clock installed",
      "unlocked iPad"
    ],
    "permissions": [
      "Trust This Computer"
    ]
  },
  "compatibility": {
    "platform": "iPadOS",
    "minimum_os": "26.6.1",
    "maximum_os": "26.6.1",
    "locales": [
      "not-applicable"
    ],
    "verification": "unverified",
    "app_versions": []
  },
  "privacy": {
    "data_access": [
      "Clock foreground state only"
    ],
    "data_sent": [],
    "retention": "The integration stores no alarm, timer, stopwatch, city, or clock data.",
    "notes": "Production Clock is CoreDevice-only and launch-only. Exact-profile rendered launch evidence is recorded separately; no timer, alarm, stopwatch, tab, or App Intent payload is exposed."
  }
}
