{
  "$schema": "../../schemas/integration-v1.json",
  "schema": "ipad-agent.integration/v1",
  "version": 1,
  "id": "appstore",
  "name": "App Store",
  "kind": "core",
  "bundle_ids": [
    "com.apple.AppStore"
  ],
  "aliases": [
    "appstore",
    "app store",
    "apple app store"
  ],
  "capabilities": [
    "launch"
  ],
  "selectors": {},
  "actions": {
    "activate": {
      "description": "Bring App Store to the foreground without selecting content or starting an account, download, or purchase flow.",
      "capability": "launch",
      "steps": [
        {
          "operation": "activate"
        }
      ],
      "safety": "navigate",
      "retry": "safe_repeat"
    }
  },
  "scenarios": {
    "activate-direct": {
      "description": "Foreground App Store without selecting content.",
      "capabilities": [
        "launch"
      ],
      "actions": [
        "activate"
      ],
      "safety": "navigate",
      "retry": "safe_repeat"
    }
  },
  "safety": {
    "classification": "bounded-ui-navigation",
    "mutates_user_data": false,
    "requires_confirmation": [],
    "prohibited": [
      "searching, inspecting accounts, downloading, updating, subscribing, purchasing, rating, reviewing, or submitting",
      "operating price, Get, cloud-download, payment, account, or protected confirmation controls",
      "guessing product identifiers or broadening product URLs"
    ],
    "uncertain_outcome": "The product page may already have opened. Inspect and do not replay."
  },
  "retry": {
    "default": "inspect_then_decide",
    "max_attempts": 1,
    "idempotent_actions": [
      "activate"
    ]
  },
  "requirements": {
    "host": [
      "macOS with Xcode CoreDevice support",
      "Python 3.11 or newer"
    ],
    "device": [
      "paired physical iPad",
      "unlocked iPad for dispatch"
    ],
    "permissions": [
      "Trust This Computer"
    ]
  },
  "compatibility": {
    "platform": "iPadOS",
    "minimum_os": "17.0",
    "maximum_os": null,
    "locales": [
      "en"
    ],
    "verification": "unverified",
    "app_versions": []
  },
  "privacy": {
    "data_access": [
      "No account, purchase, installed-app, or listing data is read"
    ],
    "data_sent": [
      "One explicit App Store product identifier when requested"
    ],
    "retention": "No product identifier, screenshot, device identifier, or raw response is committed as evidence.",
    "notes": "Product-page navigation stops before all acquisition and account controls."
  }
}
